"DESCRIPTION","DURATION IN MS","NAME","PARENT SUITE","START TIME","STATUS","STOP TIME","SUB SUITE","SUITE","TEST CLASS","TEST METHOD"
"","3734","Successful User Registration @smoke @regression","chromium","Sat Jul 26 14:36:40 UTC 2025","passed","Sat Jul 26 14:36:44 UTC 2025","User Registration","specs/signup/registration.spec.ts","",""
"","1861","Should show error message for already registered email @negative @regression","chromium","Sat Jul 26 14:36:44 UTC 2025","passed","Sat Jul 26 14:36:46 UTC 2025","Signup with Existing User","specs/signup/signup-negative.spec.ts","",""
"","2878","Verify searching and adding certain product to the Cart @smoke @regression","chromium","Sat Jul 26 14:36:37 UTC 2025","passed","Sat Jul 26 14:36:40 UTC 2025","Search and Add Product","specs/product/search-add-product.spec.ts","",""
"","2238","Should show error message for invalid login credentials @negative @regression","chromium","Sat Jul 26 14:36:35 UTC 2025","passed","Sat Jul 26 14:36:37 UTC 2025","Invalid User Login","specs/login/login-negative.spec.ts","",""
"","3623","Successful User Login via API-created user @smoke @regression","chromium","Sat Jul 26 14:36:31 UTC 2025","passed","Sat Jul 26 14:36:35 UTC 2025","","specs/login/login-logout.spec.ts","",""
